{
  "widget_id": "productspec--ref-cassunut",
  "taxonomy_id": "ProductSpec",
  "category": "trust",
  "style_tags": [
    "내추럴",
    "따뜻한",
    "라이트톤"
  ],
  "theme": "light",
  "composition": "stack",
  "provenance": {
    "source_ref": "ref-cassunut",
    "extracted_date": "2026-02-12"
  },
  "status": "new",
  "copywriting_guide": "제품 상세 사양을 깔끔한 테이블로 정리하여 구매 판단에 필요한 정보 제공",
  "canvas": {
    "width": 860,
    "height": 700
  },
  "elements": [
    {
      "id": "bg",
      "type": "background",
      "label": "섹션 배경",
      "x": 0,
      "y": 0,
      "w": 100,
      "h": 100,
      "zIndex": 0,
      "style": {
        "bgColor": "#FFFFFF"
      }
    },
    {
      "id": "text_0",
      "type": "text",
      "label": "제목 (h2)",
      "x": 10,
      "y": 31.666666666666668,
      "w": 80,
      "h": 24.666666666666668,
      "zIndex": 1,
      "content": "[제품 사양]",
      "style": {
        "fontSize": "28px",
        "fontWeight": "bold",
        "color": "#2D2D2D"
      }
    },
    {
      "id": "text_1",
      "type": "text",
      "label": "텍스트",
      "x": 10,
      "y": 58.333333333333336,
      "w": 80,
      "h": 24.666666666666668,
      "zIndex": 2,
      "content": "[제조국, 유통기한 등 공통 정보]",
      "style": {
        "fontSize": "14px",
        "color": "#AAAAAA"
      }
    }
  ],
  "html_body": "<section id=\"productspec\" class=\"flex flex-col items-center gap-6 section-padding\" style=\"background: #FFFFFF;\">\n  <div class=\"content-narrow flex flex-col items-center gap-8 text-center\">\n    <h2 class=\"text-[28px] font-bold\" style=\"color: #2D2D2D;\">[제품 사양]</h2>\n    <div class=\"w-full flex flex-col gap-0 text-left\">\n      <div class=\"flex justify-between py-4\" style=\"border-bottom: 1px solid #E8E8E8;\">\n        <span class=\"text-[16px]\" style=\"color: #888888;\">[항목 1]</span>\n        <span class=\"text-[16px]\" style=\"color: #2D2D2D;\">[값 1]</span>\n      </div>\n      <div class=\"flex justify-between py-4\" style=\"border-bottom: 1px solid #E8E8E8;\">\n        <span class=\"text-[16px]\" style=\"color: #888888;\">[항목 2]</span>\n        <span class=\"text-[16px]\" style=\"color: #2D2D2D;\">[값 2]</span>\n      </div>\n      <div class=\"flex justify-between py-4\" style=\"border-bottom: 1px solid #E8E8E8;\">\n        <span class=\"text-[16px]\" style=\"color: #888888;\">[항목 3]</span>\n        <span class=\"text-[16px]\" style=\"color: #2D2D2D;\">[값 3]</span>\n      </div>\n      <div class=\"flex justify-between py-4\" style=\"border-bottom: 1px solid #E8E8E8;\">\n        <span class=\"text-[16px]\" style=\"color: #888888;\">[항목 4]</span>\n        <span class=\"text-[16px] font-semibold\" style=\"color: #C19A4C;\">[값 4 (강조)]</span>\n      </div>\n      <div class=\"flex justify-between py-4\" style=\"border-bottom: 1px solid #E8E8E8;\">\n        <span class=\"text-[16px]\" style=\"color: #888888;\">[항목 5]</span>\n        <span class=\"text-[16px]\" style=\"color: #2D2D2D;\">[값 5]</span>\n      </div>\n    </div>\n    <p class=\"text-[14px] mt-2\" style=\"color: #AAAAAA;\">[제조국, 유통기한 등 공통 정보]</p>\n  </div>\n</section>",
  "figma_hints": {
    "layout_structure": "Single-column stacked layout, centered content. Canvas 860px.",
    "key_elements": [
      "제목 텍스트 1개",
      "본문 텍스트 1개",
      "스타일: 내추럴, 따뜻한, 라이트톤",
      "카피 가이드: 제품 상세 사양을 깔끔한 테이블로 정리하여 구매 판단에 필요한 정보 제공"
    ]
  },
  "sample_data": {
    "texts": {
      "[제품 사양]": "제품 상세 정보",
      "[항목 1]": "품목",
      "[값 1]": "견과류 가공품",
      "[항목 2]": "원재료",
      "[값 2]": "캐슈넛 100% (베트남산)",
      "[항목 3]": "내용량",
      "[값 3]": "300g / 200g",
      "[항목 4]": "유통기한",
      "[값 4 (강조)]": "제조일로부터 12개월",
      "[항목 5]": "보관방법",
      "[값 5]": "직사광선을 피해 서늘한 곳에 보관",
      "[제조국, 유통기한 등 공통 정보]": "제조국: 대한민국 · 제조원: (주)오리지넛 식품 · 소비자 상담실: 1588-0000"
    }
  }
}