{
  "widget_id": "productspec--ref-cassunut--v2",
  "taxonomy_id": "ProductSpec",
  "category": "trust",
  "style_tags": [
    "내추럴",
    "따뜻한",
    "라이트톤"
  ],
  "theme": "light",
  "composition": "stack",
  "provenance": {
    "source_ref": "ref-cassunut",
    "extracted_date": "2026-02-12",
    "analysis_version": "2.0"
  },
  "status": "new",
  "copywriting_guide": "깔끔한 테이블 형태로 제품 상세 사양 나열, 구분선으로 행 분리",
  "canvas": {
    "width": 860,
    "height": 700
  },
  "elements": [
    {
      "id": "bg",
      "type": "background",
      "label": "섹션 배경",
      "x": 0,
      "y": 0,
      "w": 100,
      "h": 100,
      "zIndex": 0,
      "style": {
        "bgColor": "#FFFFFF"
      }
    },
    {
      "id": "text_0",
      "type": "text",
      "label": "제목 (h2)",
      "x": 10,
      "y": 45,
      "w": 80,
      "h": 38,
      "zIndex": 1,
      "content": "[스펙 제목]",
      "style": {
        "fontSize": "24px",
        "fontWeight": "bold",
        "color": "#2D2D2D"
      }
    }
  ],
  "html_body": "<section id=\"productspec\" class=\"flex flex-col items-center py-[60px] px-[50px]\" style=\"background: #FFFFFF;\">\n  <div class=\"content-narrow flex flex-col items-center gap-6 text-center\">\n    <!-- 섹션 제목 -->\n    <h2 class=\"text-[24px] font-bold\" style=\"color: #2D2D2D;\">[스펙 제목]</h2>\n    <!-- v2: CARD 컨테이너 (bounds 기반 스타일) -->\n    <div class=\"w-full rounded-xl p-[24px]\" style=\"background: #F9F9F9; border: 1px solid #E8E8E8;\">\n      <div class=\"flex flex-col\">\n        <!-- 스펙 행 1 -->\n        <div class=\"flex justify-between py-3 text-left\">\n          <span class=\"text-[16px] font-medium\" style=\"color: #2D2D2D;\">[스펙 1 항목]</span>\n          <span class=\"text-[16px]\" style=\"color: #666666;\">[스펙 1 값]</span>\n        </div>\n        <!-- v2: LINE 행 구분선 -->\n        <div class=\"w-full h-px\" style=\"background: #E8E8E8; opacity: 0.8;\"></div>\n        <!-- 스펙 행 2 -->\n        <div class=\"flex justify-between py-3 text-left\">\n          <span class=\"text-[16px] font-medium\" style=\"color: #2D2D2D;\">[스펙 2 항목]</span>\n          <span class=\"text-[16px]\" style=\"color: #666666;\">[스펙 2 값]</span>\n        </div>\n        <div class=\"w-full h-px\" style=\"background: #E8E8E8; opacity: 0.8;\"></div>\n        <!-- 스펙 행 3 -->\n        <div class=\"flex justify-between py-3 text-left\">\n          <span class=\"text-[16px] font-medium\" style=\"color: #2D2D2D;\">[스펙 3 항목]</span>\n          <span class=\"text-[16px]\" style=\"color: #666666;\">[스펙 3 값]</span>\n        </div>\n        <div class=\"w-full h-px\" style=\"background: #E8E8E8; opacity: 0.8;\"></div>\n        <!-- 스펙 행 4 -->\n        <div class=\"flex justify-between py-3 text-left\">\n          <span class=\"text-[16px] font-medium\" style=\"color: #2D2D2D;\">[스펙 4 항목]</span>\n          <span class=\"text-[16px]\" style=\"color: #666666;\">[스펙 4 값]</span>\n        </div>\n        <div class=\"w-full h-px\" style=\"background: #E8E8E8; opacity: 0.8;\"></div>\n        <!-- 스펙 행 5 -->\n        <div class=\"flex justify-between py-3 text-left\">\n          <span class=\"text-[16px] font-medium\" style=\"color: #2D2D2D;\">[스펙 5 항목]</span>\n          <span class=\"text-[16px]\" style=\"color: #666666;\">[스펙 5 값]</span>\n        </div>\n      </div>\n    </div>\n  </div>\n</section>",
  "figma_hints": {
    "layout_structure": "Single-column stacked layout, centered content. Canvas 860px.",
    "key_elements": [
      "제목 텍스트 1개",
      "스타일: 내추럴, 따뜻한, 라이트톤",
      "카피 가이드: 깔끔한 테이블 형태로 제품 상세 사양 나열, 구분선으로 행 분리"
    ]
  },
  "sample_data": {
    "texts": {
      "[스펙 제목]": "제품 상세 정보",
      "[스펙 1 항목]": "제품명",
      "[스펙 1 값]": "프리미엄 캐슈넛",
      "[스펙 2 항목]": "원산지",
      "[스펙 2 값]": "베트남",
      "[스펙 3 항목]": "중량",
      "[스펙 3 값]": "500g",
      "[스펙 4 항목]": "보관방법",
      "[스펙 4 값]": "직사광선을 피해 서늘한 곳",
      "[스펙 5 항목]": "유통기한",
      "[스펙 5 값]": "제조일로부터 12개월"
    },
    "images": []
  }
}