{
  "widget_id": "hook--ref-cassunut--v2",
  "taxonomy_id": "Hook",
  "category": "intro",
  "style_tags": [
    "내추럴",
    "따뜻한",
    "라이트톤"
  ],
  "theme": "light",
  "composition": "stack",
  "provenance": {
    "source_ref": "ref-cassunut",
    "extracted_date": "2026-02-12",
    "analysis_version": "2.0"
  },
  "status": "new",
  "copywriting_guide": "프리미엄 식품의 품질과 산지를 강조하는 메인 카피로 시선 사로잡기",
  "canvas": {
    "width": 860,
    "height": 700
  },
  "elements": [
    {
      "id": "bg",
      "type": "background",
      "label": "섹션 배경",
      "x": 0,
      "y": 0,
      "w": 100,
      "h": 100,
      "zIndex": 0,
      "style": {
        "bgColor": "#FFFFFF"
      }
    },
    {
      "id": "img_0",
      "type": "image",
      "label": "메인 제품 패키지 이미지",
      "x": 5,
      "y": 30,
      "w": 90,
      "h": 50,
      "zIndex": 1,
      "placeholder": {
        "ai_prompt": "[product] packaging bags, two premium cashew nut packages, studio photography, white background, 8k quality",
        "ai_style": "product_hero",
        "ai_ratio": "16:9"
      }
    },
    {
      "id": "text_0",
      "type": "text",
      "label": "텍스트",
      "x": 10,
      "y": 10,
      "w": 80,
      "h": 5,
      "zIndex": 2,
      "content": "[메인 카피]",
      "style": {}
    },
    {
      "id": "text_1",
      "type": "text",
      "label": "제목 (h1)",
      "x": 10,
      "y": 15,
      "w": 80,
      "h": 5,
      "zIndex": 3,
      "content": "[서브 메인 카피]",
      "style": {
        "fontSize": "40px",
        "fontWeight": "bold",
        "color": "#2D2D2D"
      }
    },
    {
      "id": "text_2",
      "type": "text",
      "label": "텍스트",
      "x": 10,
      "y": 20,
      "w": 80,
      "h": 5,
      "zIndex": 4,
      "content": "[서브 카피]",
      "style": {
        "fontSize": "18px",
        "color": "#C19A4C"
      }
    },
    {
      "id": "text_3",
      "type": "text",
      "label": "텍스트",
      "x": 10,
      "y": 25,
      "w": 80,
      "h": 5,
      "zIndex": 5,
      "content": "메인 제품 패키지 이미지\n    \n    \n    \n      [포인트 라벨]",
      "style": {}
    }
  ],
  "html_body": "<section id=\"hook\" class=\"flex flex-col items-center py-[60px] px-[50px]\" style=\"background: #FFFFFF;\">\n  <div class=\"content-narrow flex flex-col items-center gap-[16px] text-center\">\n    <!-- 브랜드 로고 -->\n    <div class=\"flex items-center gap-2\">\n      <svg width=\"30\" height=\"30\" viewBox=\"0 0 24 24\" fill=\"none\" stroke=\"#C19A4C\" stroke-width=\"1.5\"><circle cx=\"12\" cy=\"12\" r=\"10\"/><path d=\"M8 12l3 3 5-5\"/></svg>\n    </div>\n    <!-- 카테고리 라벨 -->\n    <p class=\"text-[14px]\" style=\"color: #888888;\">[메인 카피]</p>\n    <!-- 구분선 -->\n    <div class=\"w-[200px] h-px mx-auto\" style=\"background: linear-gradient(90deg, transparent, #E8E8E8, transparent); opacity: 0.5;\"></div>\n    <!-- 메인 카피 -->\n    <h1 class=\"text-[40px] font-bold leading-tight tracking-tight\" style=\"color: #2D2D2D;\">\n      [서브 메인 카피]\n    </h1>\n    <!-- 서브 카피 -->\n    <p class=\"text-[18px]\" style=\"color: #C19A4C;\">[서브 카피]</p>\n    <!-- 제품 이미지 -->\n    <div class=\"img-placeholder w-[760px] h-[470px] rounded-xl mt-4\" style=\"background: #E8E8E8;\"\n         data-ai-prompt=\"[product] packaging bags, two premium cashew nut packages, studio photography, white background, 8k quality\"\n         data-ai-style=\"product_hero\"\n         data-ai-ratio=\"16:9\">\n      <svg width=\"36\" height=\"36\" viewBox=\"0 0 24 24\" fill=\"none\" stroke=\"currentColor\" stroke-width=\"1.5\">\n        <path d=\"M23 19a2 2 0 0 1-2 2H3a2 2 0 0 1-2-2V8a2 2 0 0 1 2-2h4l2-3h6l2 3h4a2 2 0 0 1 2 2z\"/>\n        <circle cx=\"12\" cy=\"13\" r=\"4\"/>\n      </svg>\n      <span class=\"img-label\">메인 제품 패키지 이미지</span>\n    </div>\n    <!-- 포인트 안내 + 화살표 -->\n    <div class=\"flex flex-col items-center gap-[8px] mt-6\">\n      <p class=\"text-[14px] font-medium\" style=\"color: #C19A4C;\">[포인트 라벨]</p>\n      <svg width=\"30\" height=\"30\" viewBox=\"0 0 24 24\" fill=\"none\" stroke=\"#C19A4C\" stroke-width=\"2\">\n        <path d=\"M12 5v14M5 12l7 7 7-7\"/>\n      </svg>\n    </div>\n  </div>\n</section>",
  "figma_hints": {
    "layout_structure": "Single-column stacked layout, centered content. Canvas 860px.",
    "key_elements": [
      "1개 이미지 플레이스홀더",
      "제목 텍스트 1개",
      "본문 텍스트 3개",
      "스타일: 내추럴, 따뜻한, 라이트톤",
      "카피 가이드: 프리미엄 식품의 품질과 산지를 강조하는 메인 카피로 시선 사로잡기"
    ]
  },
  "sample_data": {
    "texts": {
      "[브랜드명]": "ORIGINUT",
      "[메인 카피]": "건조 캐슈넛의 새로운 기준",
      "[서브 메인 카피]": "프리미엄 캐슈넛 ORIGINUT",
      "[서브 카피]": "최상급 원료로 만든 프리미엄 캐슈넛",
      "[포인트 라벨]": "ORIGINUT's Point"
    },
    "images": [
      {
        "label": "메인 제품 패키지 이미지",
        "src": "https://images.unsplash.com/photo-1509721434272-b79147e0e708?w=760&fit=crop&q=80",
        "alt": "프리미엄 캐슈넛 패키지"
      }
    ]
  }
}